symbol,company,last.sale.price,market.cap,country,ipo.year,industry
CPG,Crescent Point Energy Corporation Ordinary Shares (Canada),5.2509,3055953270,Canada,NA,
CPK,Chesapeake Utilities Corporation Common Stock,143.22,2521272951,United States,NA,Oil & Gas Production
CPLG,CorePoint Lodging Inc. Common Stock,15.675,913543577,,2018,Real Estate Investment Trusts
CPNG,Coupang Inc. Class A Common Stock,30.06,52648331700,,2021,Recreational Products/Toys
CPRI,Capri Holdings Limited Ordinary Shares,65.2,9809911152,Hong Kong,2011,Apparel
CPS,Cooper-Standard Holdings Inc. Common Stock,22.09,375335984,United States,NA,Auto Parts:O.E.M.
CPSR,Capstar Special Purpose Acquisition Corp. Class A Common Stock,9.965,343792500,,2020,
CPT,Camden Property Trust Common Stock,177.6,18150237461,United States,1993,Real Estate Investment Trusts
CPTK,Crown PropTech Acquisitions Class A Ordinary Shares,9.89,341205000,,2021,Business Services
CPUH,Compute Health Acquisition Corp. Class A Common Stock,9.73,1049015625,,2021,
CR,Crane Co. Common Stock,101.68,5971368376,United States,NA,Office Equipment/Supplies/Services
CRC,California Resources Corporation Common Stock,43.05,3460914216,,2020,Oil & Gas Production
CRD/A,Crawford & Company,7.58,NA,United States,NA,
CRD/B,Crawford & Company,7.5,NA,United States,NA,
CRGY,Crescent Energy Company Class A Common Stock,13.37,576234967,,2021,
CRH,CRH PLC American Depositary Shares,52.85,40748607619,Ireland,NA,Building Materials
CRHC,Cohn Robbins Holdings Corp. Class A Ordinary Shares,9.83,1017405000,United States,2020,Business Services
CRI,Carter's Inc. Common Stock,102.16,4317873209,United States,2003,Department/Specialty Retail Stores
CRK,Comstock Resources Inc. Common Stock,8.475,1974036375,United States,NA,Oil & Gas Production
CRL,Charles River Laboratories International Inc. Common Stock,379.08,19130044373,United States,2000,EDP Services
CRM,Salesforce.com Inc Common Stock,257.44,253578400000,United States,2004,Computer Software: Prepackaged Software
CRS,Carpenter Technology Corporation Common Stock,29.27,1410436241,United States,NA,Steel/Iron Ore
CRT,Cross Timbers Royalty Trust Common Stock,11.77,70620000,United States,1992,Oil & Gas Production
CRU,Crucible Acquisition Corporation Class A Common Stock,9.7341,314837297,,2021,
CRY,CryoLife Inc. Common Stock,20.49,805863094,United States,NA,Medical/Dental Instruments
CS,Credit Suisse Group American Depositary Shares,9.655,23095797343,Switzerland,NA,Investment Bankers/Brokers/Service
CSAN,Cosan S.A. ADS,15.52,7248551390,,2021,Automotive Aftermarket
CSL,Carlisle Companies Incorporated Common Stock,247.24,12926837087,United States,NA,
CSLT,Castlight Health Inc. Class B Common Stock,1.57,254545851,,2014,Managed Health Care
CSPR,Casper Sleep Inc. Common Stock,6.735,280328480,,2020,Diversified Commercial Services
CSR,D/B/A Centerspace Common Stock,111.1,1586567439,United States,NA,Real Estate Investment Trusts
CSR^C,D/B/A Centerspace 6.625% Series C,25.78,NA,United States,NA,
CSTA,Constellation Acquisition Corp I Class A Ordinary Shares,9.77,387136250,,2021,Business Services
CSTM,Constellium SE Ordinary Shares (France),18.04,2555859683,Netherlands,2013,Aluminum
CSV,Carriage Services Inc. Common Stock,65.03,1082895232,United States,NA,Other Consumer Services
CTA^A,E.I. du Pont de Nemours and Company Preferred Stock,94.35,NA,United States,NA,
CTA^B,E.I. du Pont de Nemours and Company Preferred Stock,109.005,NA,United States,NA,
CTBB,Qwest Corporation 6.5% Notes due 2056,25.39,0,United States,2016,
CTDD,Qwest Corporation 6.75% Notes due 2057,25.53,0,United States,2017,
CTK,CooTek (Cayman) Inc. American Depositary Shares each representing 50 Class A Ordinary Shares,0.6983,46928194,,2018,EDP Services
CTLT,Catalent Inc. Common Stock,129.425,22156012336,United States,2014,Biotechnology: Pharmaceutical Preparations
CTO,CTO Realty Growth Inc. Common Stock,61.2,364883580,United States,NA,Real Estate Investment Trusts
CTO^A,CTO Realty Growth Inc. 6.375% Series A Cumulative Redeemable Preferred Stock,26.17,NA,United States,NA,
CTOS,Custom Truck One Source Inc. Common Stock,7.875,1947578015,Cayman Islands,2017,Diversified Commercial Services
CTR,ClearBridge MLP and Midstream Total Return Fund Inc. Common Stock,23.465,167014461,United States,2012,Investment Managers
CTRA,Coterra Energy Inc. Common Stock,19.718,16042123886,United States,NA,Oil & Gas Production
CTS,CTS Corporation Common Stock,37.07,1194564143,United States,NA,Industrial Machinery/Components
CTT,CatchMark Timber Trust Inc. Class A Common Stock,8.74,427284826,United States,2013,Real Estate Investment Trusts
CTV,Innovid Corp. Common Stock,6.6,785014679,,2021,Advertising
CTVA,Corteva Inc. Common Stock,47.3,34477395700,,2019,Major Chemicals
CUBB,Customers Bancorp Inc 5.375% Subordinated Notes Due 2034,26.76,0,United States,2019,Major Banks
CUBE,CubeSmart Common Shares,56.985,12468929050,United States,NA,Real Estate Investment Trusts
CUBI,Customers Bancorp Inc Common Stock,64.35,2085736524,United States,NA,Major Banks
CUBI^E,Customers Bancorp Inc Fixed-to-Floating Rate Non-Cumulative Perpetual Preferred Stock Series E,25.34,NA,United States,NA,
CUBI^F,Customers Bancorp Inc Fixed-to-Floating Rate Non-Cumulative Perpetual Preferred Stock Series F,25.223,NA,United States,NA,
CUK,Carnival Plc ADS ADS,18.97,22098723352,United States,NA,Marine Transportation
CULP,Culp Inc. Common Stock,9,109887390,United States,NA,Textiles
CURO,CURO Group Holdings Corp. Common Stock,16.06,649664516,,2017,Diversified Financial Services
CURV,Torrid Holdings Inc. Common Stock,9.98,1098716324,,2021,Clothing/Shoe/Accessory Stores
CUZ,Cousins Properties Incorporated Common Stock,40.5601,6030801609,United States,NA,Real Estate Investment Trusts
CVE,Cenovus Energy Inc Common Stock,12.12,24454250318,Canada,NA,
CVEO,Civeo Corporation (Canada) Common Shares,18.63,265480853,,2014,
CVI,CVR Energy Inc. Common Stock,16.825,1691427328,United States,2007,Integrated oil Companies
CVII,Churchill Capital Corp VII Class A Common Stock,9.805,1691362500,,2021,
CVNA,Carvana Co. Class A Common Stock,235.825,20183616769,United States,2017,Other Specialty Stores
CVS,CVS Health Corporation Common Stock,103.715,136909883611,United States,NA,Managed Health Care
CVX,Chevron Corporation Common Stock,117.64,226772971511,United States,NA,Integrated oil Companies
CW,Curtiss-Wright Corporation Common Stock,138.58,5437838457,United States,NA,Industrial Machinery/Components
CWAN,Clearwater Analytics Holdings Inc. Class A Common Stock,22.36,3967778512,,2021,Computer Software: Prepackaged Software
CWEN,Clearway Energy Inc. Class C Common Stock,36.1,4201225692,United States,2015,Electric Utilities: Central
CWH,Camping World Holdings Inc. Class A Commom Stock,41.32,1853337778,United States,2016,Other Specialty Stores
CWK,Cushman & Wakefield plc Ordinary Shares,22.595,5049289308,,2018,Real Estate
CWT,California Water Service Group Common Stock,71.2225,3746873280,United States,NA,Water Supply
CX,Cemex S.A.B. de C.V. Sponsored ADR,6.735,99199617840,Mexico,NA,Building Materials
CXE,MFS High Income Municipal Trust Common Stock,5.061,159541284,United States,1989,Investment Managers
CXH,MFS Investment Grade Municipal Trust Common Stock,10.06,91649065,United States,1989,Investment Managers
CXM,Sprinklr Inc. Class A Common Stock,15.93,4070145426,,2021,Computer Software: Prepackaged Software
CXW,CoreCivic Inc. Common Stock,10.08,1212470431,United States,NA,Real Estate Investment Trusts
CYD,China Yuchai International Limited Common Stock,13.36,545866754,Singapore,1994,Construction/Ag Equipment/Trucks
CYH,Community Health Systems Inc. Common Stock,13.64,1801951974,United States,2000,Hospital/Nursing Management
CZOO,Cazoo Group Ltd Class A Ordinary Shares,6.3,4738562886,,NA,Automotive Aftermarket
D,Dominion Energy Inc. Common Stock,78.26,63383432010,United States,NA,Electric Utilities: Central
DAC,Danaos Corporation Common Stock,71.9668,1482277150,Greece,2006,Marine Transportation
DAL,Delta Air Lines Inc. Common Stock,39.33,25171743462,United States,NA,Air Freight/Delivery Services
DAN,Dana Incorporated Common Stock,22.9,3302961806,United States,NA,Auto Parts:O.E.M.
DAO,Youdao Inc. American Depositary Shares each representing one Class A Ordinary Share,11.8019,1463210845,,2019,Other Consumer Services
DAR,Darling Ingredients Inc. Common Stock,68.52,11087098755,United States,NA,Farming/Seeds/Milling
DASH,DoorDash Inc. Class A Common Stock,154.99,53171555696,,2020,Industrial Machinery/Components
DAVA,Endava plc American Depositary Shares (each representing one Class A Ordinary Share),167,9351014199,United States,2018,EDP Services
DB,Deutsche Bank AG Common Stock,12.58,26355100000,Germany,NA,Commercial Banks
DBD,Diebold Nixdorf Incorporated Common Stock,9.01,705980830,United States,NA,EDP Services
DBI,Designer Brands Inc. Class A Common Stock,14.67,1076101317,United States,NA,Clothing/Shoe/Accessory Stores
DBL,DoubleLine Opportunistic Credit Fund Common Shares of Beneficial Interest,19.08,293792848,United States,2012,
DBRG,DigitalBridge Group Inc.,8.385,4758276500,United States,2014,Real Estate Investment Trusts
DBRG^H,DigitalBridge Group Inc. 7.125% Series H,25.2508,NA,United States,NA,
DBRG^I,DigitalBridge Group Inc. 7.15% Series I,25.792,NA,United States,NA,
DBRG^J,DigitalBridge Group Inc. 7.125% Series J,26.05,NA,United States,NA,
DCF,BNY Mellon Alcentra Global Credit Income 2024 Target Term Fund Inc. Common Stock,9.33,139761982,,2017,Finance/Investors Services
DCI,Donaldson Company Inc. Common Stock,59.05,7294566844,United States,NA,Pollution Control Equipment
DCO,Ducommun Incorporated Common Stock,46.86,558720637,United States,NA,Military/Government/Technical
DCP,DCP Midstream  LP Common Units,26.73,5569828253,United States,NA,Natural Gas Distribution
DCP^B,DCP Midstream LP 7.875% Series B Fixed-to-Floating Rate Cumulative Redeemable Perpetual Preferred Units,25.3,NA,United States,NA,
DCP^C,DCP Midstream LP 7.95% Series C Fixed-to-Floating Rate Cumulative Redeemable Perpetual Preferred Units,25.501,NA,United States,NA,
DCUE,Dominion Energy Inc. 2019 Series A Corporate Units,100.5,0,United States,2019,Electric Utilities: Central
DD,DuPont de Nemours Inc. Common Stock,80.31,41608919551,,2017,Wholesale Distributors
DDD,3D Systems Corporation Common Stock,22.44,2882403885,United States,NA,Computer peripheral equipment
DDF,Delaware Investments Dividend & Income Fund Inc. Common Stock,11.225,85435249,United States,1993,Finance/Investors Services
DDL,Dingdong (Cayman) Limited American Depositary Shares (each two representing three Ordinary Shares),15.69,3703645415,,2021,
DDS,Dillard's Inc. Common Stock,252.75,4911987479,United States,NA,Department/Specialty Retail Stores
DDT,Dillard's Capital Trust I,26.9619,0,United States,NA,Department/Specialty Retail Stores
DE,Deere & Company Common Stock,344.136,105789912398,United States,NA,Industrial Machinery/Components
DEA,Easterly Government Properties Inc. Common Stock,23.035,1984189705,United States,2015,Real Estate Investment Trusts
DECK,Deckers Outdoor Corporation Common Stock,371.79,10204936535,United States,1993,Shoe Manufacturing
DEI,Douglas Emmett Inc. Common Stock,33.95,5957742231,United States,2006,Real Estate Investment Trusts
DELL,Dell Technologies Inc. Class C Common Stock,56.94,43495607516,,2018,Computer Manufacturing
DEN,Denbury Inc. Common Stock,75.51,3784743708,,2020,Oil & Gas Production
DEO,Diageo plc Common Stock,219.36,127617967015,United Kingdom,NA,Beverages (Production/Distribution)
DESP,Despegar.com Corp. Ordinary Shares,9.78,685571428,,2017,Other Consumer Services
DEX,Delaware Enhanced Global Dividend Common Shares of Beneficial Interest,10.17,114963022,United States,2007,Finance Companies
DFIN,Donnelley Financial Solutions Inc. Common Stock,47.77,1583281715,,2016,Investment Managers
DFP,Flaherty & Crumrine Dynamic Preferred and Income Fund Inc. Common Stock,27.645,535562051,,2013,Investment Managers
DFS,Discover Financial Services Common Stock,116.605,34398475000,United States,NA,Finance: Consumer Services
DG,Dollar General Corporation Common Stock,236.54,54807856456,United States,2009,Department/Specialty Retail Stores
DGX,Quest Diagnostics Incorporated Common Stock,171.33,21017868515,United States,NA,Medical Specialities
DHF,BNY Mellon High Yield Strategies Fund Common Stock,3.15,229096734,United States,1998,Finance Companies
DHI,D.R. Horton Inc. Common Stock,108.14,38517455731,United States,NA,
DHR,Danaher Corporation Common Stock,329.05,235131518415,United States,NA,Medical Specialities
DHR^A,Danaher Corporation 4.75% Mandatory Convertible Preferred Stock Series A,2189.78,NA,United States,NA,
DHR^B,Danaher Corporation 5.00% Mandatory Convertible Preferred Stock Series B,1738.42,NA,United States,NA,
DHT,DHT Holdings Inc.,5.215,869277299,Jersey,2005,Marine Transportation
DHX,DHI Group Inc. Common Stock,6.07,300720298,United States,2007,Diversified Commercial Services
DIAX,Nuveen Dow 30SM Dynamic Overwrite Fund Common Shares of Beneficial Interest,17.84,648785728,,2014,Finance Companies
DIDI,DiDi Global Inc. American Depositary Shares (each four representing one Class A Ordinary Share),5.245,25297901542,,2021,
DIN,Dine Brands Global Inc. Common Stock,77.86,1340517411,United States,NA,Restaurants
DIS,Walt Disney Company (The) Common Stock,156.16,283845152840,United States,NA,Movies/Entertainment
DK,Delek US Holdings Inc. Common Stock,15.36,1138559032,United States,2017,Integrated oil Companies
DKL,Delek Logistics Partners L.P. Common Units representing Limited Partner Interests,43.09,1872651025,United States,2012,Oil & Gas Production
DKS,Dick's Sporting Goods Inc Common Stock,113.41,9821978408,United States,2002,Other Specialty Stores
DLB,Dolby Laboratories Common Stock,96.17,9716031827,United States,2005,EDP Services
DLNG,Dynagas LNG Partners LP Common Units,2.88,105990471,Greece,NA,
DLNG^A,Dynagas LNG Partners LP 9.00% Series A Cumulative Redeemable Preferred Units,25.4101,NA,Greece,NA,
DLNG^B,Dynagas LNG Partners LP 8.75% Series B Fixed to Floating Rate Cumulative Redeemable Perpetual Preferred Units liquidation preference $25.00 per Uni,25.1,NA,Greece,NA,
DLR,Digital Realty Trust Inc. Common Stock,175.775,49882740078,United States,2004,Real Estate Investment Trusts
DLR^J,Digital Realty Trust Inc. 5.250% Series J Cumulative Redeemable Preferred Stock,25.99,NA,United States,NA,
DLR^K,Digital Realty Trust Inc. 5.850% Series K Cumulative Redeemable Preferred Stock par value $0.01 per share,27.32,NA,United States,NA,
DLR^L,Digital Realty Trust Inc. 5.200% Series L Cumulative Redeemable Preferred Stock,26.5667,NA,United States,NA,
DLX,Deluxe Corporation Common Stock,32.21,1372333527,United States,NA,Advertising
DLY,DoubleLine Yield Opportunities Fund Common Shares of Beneficial Interest,18.395,881962605,,2020,Investment Managers
DM,Desktop Metal Inc. Class A Common Stock,5.1416,1599111305,,2019,Computer peripheral equipment
DMB,BNY Mellon Municipal Bond Infrastructure Fund Inc. Common Stock,14.33,263602843,,2013,Trusts Except Educational Religious and Charitable
DMO,Western Asset Mortgage Opportunity Fund Inc. Common Stock,15.3787,174173297,United States,2010,Trusts Except Educational Religious and Charitable
DMS,Digital Media Solutions Inc. Class A Ordinary Shares,4.69,290267163,United States,2018,Advertising
DMYS,dMY Technology Group Inc. VI Class A Common Stock,9.82,296441250,,2021,
DNA,Ginkgo Bioworks Holdings Inc. Class A Common Stock,9.0755,15180047043,United States,2021,Biotechnology: Biological Products (No Diagnostic Substances)
DNB,Dun & Bradstreet Holdings Inc. Common Stock,20.44,8813504754,United States,2020,EDP Services
DNMR,Danimer Scientific Inc. Common Stock,8.9,893064404,,2020,Plastic Products
DNOW,NOW Inc. Common Stock,8.635,954675506,,2014,Metal Fabrications
DNP,DNP Select Income Fund Inc. Common Stock,10.92,3723462321,United States,1987,Investment Managers
DNZ,D and Z Media Acquisition Corp. Class A Common Stock,9.75,350390625,,2021,
DOC,Physicians Realty Trust Common Shares of Beneficial Interest,18.955,4175587169,United States,2013,Real Estate Investment Trusts
DOCN,DigitalOcean Holdings Inc. Common Stock,83.78,8902999746,United States,2021,Retail: Computer Software & Peripheral Equipment
DOCS,Doximity Inc. Class A Common Stock,52.6881,9879604642,,2021,Retail: Computer Software & Peripheral Equipment
DOLE,Dole plc Ordinary Shares,13.12,1244794689,,2021,
DOMA,Doma Holdings Inc. Common Stock,5.29,1706417740,,2021,Real Estate
DOOR,Masonite International Corporation Ordinary Shares (Canada),118.22,2811148415,Canada,NA,
DOUG,Douglas Elliman Inc.,10.45,812180594,,2021,
DOV,Dover Corporation Common Stock,181.47,26128894980,United States,NA,Industrial Machinery/Components
DOW,Dow Inc. Common Stock,56.815,42021192818,,2019,Industrial Specialties
DPG,Duff & Phelps Utility and Infrastructure Fund Inc.,14.17,537465351,United States,2011,Trusts Except Educational Religious and Charitable
DPZ,Domino's Pizza Inc Common Stock,559.7025,20350974318,United States,2004,Food Distributors
DQ,DAQO New Energy Corp. American Depositary Shares each representing five ordinary shares,41.01,3014791916,China,2010,Semiconductors
DRD,DRDGOLD Limited American Depositary Shares,8.28,708034218,South Africa,NA,Precious Metals
DRE,Duke Realty Corporation Common Stock,64.99,24751460997,United States,NA,Real Estate Investment Trusts
DRH,Diamondrock Hospitality Company Common Stock,9.65,2032481456,United States,2005,Real Estate Investment Trusts
DRH^A,Diamondrock Hospitality Company 8.250% Series A Cumulative Redeemable Preferred Stock,27.5101,NA,United States,NA,
DRI,Darden Restaurants Inc. Common Stock,149.75,19435304199,United States,NA,Restaurants
DRQ,Dril-Quip Inc. Common Stock,19.67,696040358,United States,1997,Metal Fabrications
DS,Drive Shack Inc.,1.495,137679670,United States,NA,Movies/Entertainment
DS^B,Drive Shack Inc. Preferred Series B,25.22,NA,United States,NA,
DS^C,Drive Shack Inc. Preferred Series C,25.055,NA,United States,NA,
DS^D,Drive Shack Inc. Pfd Ser D,24.74,NA,United States,NA,
DSL,DoubleLine Income Solutions Fund Common Shares of Beneficial Interests,16.16,1648268740,,2013,Trusts Except Educational Religious and Charitable
DSM,BNY Mellon Strategic Municipal Bond Fund Inc. Common Stock,8.4001,415145635,United States,1989,Investment Managers
DSU,Blackrock Debt Strategies Fund Inc. Common Stock,12,559101684,United States,1998,Finance Companies
DSX,Diana Shipping inc. common stock,3.94,360647908,Greece,2005,Marine Transportation
DSX^B,Diana Shipping Inc. Perpetual Preferred Shares Series B (Marshall Islands),26.3297,NA,Greece,NA,
DT,Dynatrace Inc. Common Stock,61.86,17634504989,United States,2019,EDP Services
DTB,DTE Energy Company 2020 Series G 4.375% Junior Subordinated Debentures due 2080,25.97,0,United States,2020,Electric Utilities: Central
DTC,Solo Brands Inc. Class A Common Stock,15.34,972519721,,2021,Diversified Commercial Services
DTE,DTE Energy Company Common Stock,119.11,23074856083,United States,NA,Electric Utilities: Central
DTF,DTF Tax-Free Income Inc. Common Stock,14.243,100122123,United States,1991,Investment Managers
DTG,DTE Energy Company 2021 Series E 4.375% Junior Subordinated Debentures,26.325,0,United States,2021,Electric Utilities: Central
DTLA^,Brookfield DTLA Inc. 7.625% Series A Cumulative Redeemable Preferred Stock,10.95,NA,,NA,
DTM,DT Midstream Inc. Common Stock,48.12,4654766264,,2021,Oil & Gas Production
DTP,DTE Energy Company 6.25% Corporate Units,51.2,0,United States,NA,Electric Utilities: Central
DTW,DTE Energy Company 2017 Series E 5.25% Junior Subordinated Debentures due 2077,25.85,0,United States,2017,Electric Utilities: Central
DUK,Duke Energy Corporation (Holding Company) Common Stock,104.38,80304061169,United States,NA,Power Generation
DUK^A,Duke Energy Corporation Depositary Shares each representing a 1/1000th interest in a share of 5.75% Series A Cumulative Redeemable Perpetual Preferred Stock,27.28,NA,United States,NA,
DUKB,Duke Energy Corporation 5.625% Junior Subordinated Debentures due 2078,26.5999,0,United States,2018,Power Generation
DV,DoubleVerify Holdings Inc. Common Stock,33.49,5312788897,,2021,Computer Software: Prepackaged Software
DVA,DaVita Inc. Common Stock,113.62,11577878000,United States,NA,Medical/Nursing Services
DVN,Devon Energy Corporation Common Stock,43.985,29777845000,United States,NA,Oil & Gas Production
DWIN,Delwinds Insurance Acquisition Corp. Class A Common Stock,9.87,254534963,,2021,
DX,Dynex Capital Inc. Common Stock,16.99,622952027,United States,NA,Real Estate Investment Trusts
DX^C,Dynex Capital Inc. 6.900% Series C Fixed-to-Floating Rate Cumulative Redeemable Preferred Stock,25.654,NA,United States,NA,
DXC,DXC Technology Company Common Stock,32.74,8258298836,,NA,EDP Services
DY,Dycom Industries Inc. Common Stock,94.545,2853433147,United States,NA,Water Sewer Pipeline Comm & Power Line Construction
DYFN,Angel Oak Dynamic Financial Strategies Income Term Trust Common Shares of Beneficial Interest,20.6,83533000,,2020,Finance/Investors Services
E,ENI S.p.A. Common Stock,27.601,48850411980,Italy,NA,Oil & Gas Production
EAF,GrafTech International Ltd. Common Stock,11.96,3148137608,United States,2018,Metal Fabrications
EAI,Entergy Arkansas LLC First Mortgage Bonds 4.875% Series Due September 1 2066,25.41,0,United States,2016,
EARN,Ellington Residential Mortgage REIT Common Shares of Beneficial Interest,10.64,137632209,United States,2013,Real Estate Investment Trusts
EAT,Brinker International Inc. Common Stock,37.205,1689758534,United States,NA,Restaurants
EB,Eventbrite Inc. Class A Common Stock,17.465,1659336464,United States,2018,EDP Services
EBF,Ennis Inc. Common Stock,19.74,515637680,United States,NA,Office Equipment/Supplies/Services
EBR,Centrais Electricas Brasileiras S A American Depositary Shares (Each representing one Common Share),6.06,9507721315,,2016,Electric Utilities: Central
EBS,Emergent Biosolutions Inc. Common Stock,45.58,2452143105,United States,2006,Biotechnology: Pharmaceutical Preparations
EC,Ecopetrol S.A. American Depositary Shares,13.12,26972551710,Colombia,NA,Oil & Gas Production
ECAT,BlackRock ESG Capital Allocation Trust Common Shares of Beneficial Interest,18.56,92800,,2021,Trusts Except Educational Religious and Charitable
ECC,Eagle Point Credit Company Inc. Common Stock,14.005,483026274,United States,2014,Trusts Except Educational Religious and Charitable
ECC^D,Eagle Point Credit Company Inc. 6.75% Series D Preferred Stock,24.58,NA,United States,NA,
ECCB,Eagle Point Credit Company Inc. 7.75% Series B Term Preferred Stock due 2026,25.3901,0,United States,2016,Trusts Except Educational Religious and Charitable
ECCC,Eagle Point Credit Company Inc. 6.50% Series C Term Preferred Stock due 2031,25.25,0,United States,NA,Trusts Except Educational Religious and Charitable
ECCW,Eagle Point Credit Company Inc. 6.75% Notes due 2031,26.0177,0,United States,2021,Trusts Except Educational Religious and Charitable
ECCX,Eagle Point Credit Company Inc. 6.6875% Notes due 2028,25.25,0,United States,2018,Trusts Except Educational Religious and Charitable
ECCY,Eagle Point Credit Company Inc. 6.75% Notes due 2027,25.2697,0,United States,2017,Trusts Except Educational Religious and Charitable
ECL,Ecolab Inc. Common Stock,234.34,67154182722,United States,NA,Package Goods/Cosmetics
ECOM,ChannelAdvisor Corporation Common Stock,25.4,763243279,United States,2013,Computer Software: Prepackaged Software
ECVT,Ecovyst Inc. Common Stock,10.39,1424050377,United States,2017,Major Chemicals
ED,Consolidated Edison Inc. Common Stock,85.02,30075717535,United States,NA,Power Generation
EDD,Morgan Stanley Emerging Markets Domestic Debt Fund Inc. Morgan Stanley Emerging Markets Domestic Debt Fund Inc. Common Stock,5.5,363506688,United States,2007,Finance Companies
EDF,Stone Harbor Emerging Markets Income Fund Common Shares of Beneficial Interest,6.68,112517232,United States,2010,Investment Managers
EDI,Stone Harbor Emerging Markets Total Income Fund Common Shares of Beneficial Interests,7.73,76806254,United States,2012,Finance Companies
EDN,Empresa Distribuidora Y Comercializadora Norte S.A. (Edenor) Empresa Distribuidora Y Comercializadora Norte S.A. (Edenor) American Depositary Shares,5.46,238962546,Argentina,2007,Electric Utilities: Central
EDR,Endeavor Group Holdings Inc. Class A Common Stock,34.3208,9064461992,,2021,Movies/Entertainment
EDU,New Oriental Education & Technology Group Inc. Sponsored ADR representing 1 Ordinary Share (Cayman Islands),2.135,3623022801,China,2006,Other Consumer Services
EEA,The European Equity Fund Inc. Common Stock,10.225,71644448,United States,NA,Trusts Except Educational Religious and Charitable
EEX,Emerald Holding Inc. Common Stock,3.8902,272833198,United States,2017,Advertising
EFC,Ellington Financial Inc. Common Stock,17.16,985458766,United States,2010,Real Estate Investment Trusts
EFC^A,Ellington Financial Inc. 6.750% Series A Fixed-to-Floating Rate Cumulative Redeemable Preferred Stock,25.6943,NA,United States,NA,
EFC^B,Ellington Financial Inc. 6.250% Series B Fixed-Rate Reset Cumulative Redeemable Preferred Stock,25.195,NA,United States,NA,
EFL,Eaton Vance Floating-Rate 2022 Target Term Trust Common Shares of Beneficial Interest,9.274,219243277,United States,2017,Trusts Except Educational Religious and Charitable
EFR,Eaton Vance Senior Floating-Rate Fund Common Shares of Beneficial Interest,15.1101,427920314,United States,2003,Trusts Except Educational Religious and Charitable
EFT,Eaton Vance Floating Rate Income Trust Common Shares of Beneficial Interest,15.08,429447984,United States,2004,Finance Companies
EFX,Equifax Inc. Common Stock,293.41,35796465690,United States,NA,Advertising
EGF,Blackrock Enhanced Government Fund Inc. Common Stock,12.51,51820511,United States,2005,Trusts Except Educational Religious and Charitable
EGGF,EG Acquisition Corp. Class A Common Stock,9.74,273937500,,2021,
EGHT,8x8 Inc Common Stock,17.68,2020608552,United States,NA,EDP Services
