symbol,company,last.sale.price,market.cap,country,ipo.year,industry
HRL,Hormel Foods Corporation Common Stock,48.44,26282088330,United States,NA,Meat/Poultry/Fish
HRT,HireRight Holdings Corporation Common Stock,15.62,1240079813,,2021,
HRTG,Heritage Insurance Holdings Inc. Common Stock,6.049,168647348,,2014,Property-Casualty Insurers
HSBC,HSBC Holdings plc. Common Stock,30.185,122594890768,United Kingdom,NA,Savings Institutions
HSC,Harsco Corporation Common Stock,17.28,1368639245,United States,NA,Steel/Iron Ore
HSY,The Hershey Company Common Stock,191.12,39371432495,United States,NA,Specialty Foods
HT,Hersha Hospitality Trust Class A Common Shares of Beneficial Interest,9.19,361343724,United States,1999,Real Estate Investment Trusts
HT^C,Hersha Hospitality Trust 6.875% Series C Cumulative Redeemable Preferred Shares of Beneficial Interest,23.46,NA,United States,NA,
HT^D,Hersha Hospitality Trust 6.50% Series D Cumulative Redeemable Preferred Shares of Beneficial Interest $0.01 par value per share,22.83,NA,United States,NA,
HT^E,Hersha Hospitality Trust 6.50% Series E Cumulative Redeemable Preferred Shares of Beneficial Interest,23.3,NA,United States,NA,
HTA,Healthcare Trust of America Inc. Class A Common Stock,33.791,7462340305,United States,NA,Real Estate Investment Trusts
HTAQ,Hunt Companies Acquisition Corp. I,9.85,0,,NA,
HTD,John Hancock Tax Advantaged Dividend Income Fund Common Shares of Beneficial Interest,25.69,909667614,United States,2004,Finance Companies
HTGC,Hercules Capital Inc. Common Stock,16.586,1922307813,United States,2012,Finance Companies
HTH,Hilltop Holdings Inc.,35.21,2780202902,United States,NA,Major Banks
HTPA,Highland Transcend Partners I Corp. Class A Ordinary Shares,9.9223,372086250,,2021,Business Services
HTY,John Hancock Tax-Advantaged Global Shareholder Yield Fund Common Shares of Beneficial Interest,6.4,69875181,United States,NA,Trusts Except Educational Religious and Charitable
HUBB,Hubbell Inc Common Stock,208.42,11340316235,United States,2015,Industrial Machinery/Components
HUBS,HubSpot Inc. Common Stock,676.23,31951797848,United States,2014,Computer Software: Prepackaged Software
HUGS,USHG Acquisition Corp. Class A Common Stock,10.366,369905527,,2021,
HUM,Humana Inc. Common Stock,467.89,60139909416,United States,NA,Medical Specialities
HUN,Huntsman Corporation Common Stock,34.84,7596191469,United States,2005,Major Chemicals
HUYA,HUYA Inc. American depositary shares each  representing one Class A ordinary share,6.955,1650646021,United States,2018,Broadcasting
HVT,Haverty Furniture Companies Inc. Common Stock,31.2,555969461,United States,NA,Other Specialty Stores
HVT/A,Haverty Furniture Companies Inc.,30.33,NA,United States,NA,
HWKZ,Hawks Acquisition Corp Class A Common Stock,9.76,280600000,,2021,
HWM,Howmet Aerospace Inc. Common Stock,31.865,13613300996,United States,NA,Industrial Machinery/Components
HXL,Hexcel Corporation Common Stock,52.5,4404454268,United States,NA,Industrial Machinery/Components
HY,Hyster-Yale Materials Handling Inc. Class A Common Stock,41.218,693571164,United States,NA,Construction/Ag Equipment/Trucks
HYB,New America High Income Fund Inc. (The) Common Stock,9.2497,216155481,United States,1988,Investment Managers
HYI,Western Asset High Yield Defined Opportunity Fund Inc. Common Stock,15.12,342489833,,2010,Investment Managers
HYLN,Hyliion Holdings Corp. Class A Common Stock,6.53,1131736678,,2019,Auto Parts:O.E.M.
HYT,Blackrock Corporate High Yield Fund Inc. Common Stock,12.15,1481621337,United States,2003,Finance Companies
HZN,Horizon Global Corporation Common Shares,8.04,219384642,United States,2015,Auto Parts:O.E.M.
HZO,MarineMax Inc.  (FL) Common Stock,59.21,1294621558,United States,1998,Other Specialty Stores
HZON,Horizon Acquisition Corporation II Class A Ordinary Shares,9.84,645750000,United States,2020,Business Services
IAA,IAA Inc. Common Stock,50.87,6859625278,,2019,Business Services
IACC,ION Acquisition Corp 3 Ltd. Class A Ordinary Shares,9.75,315714750,,2021,
IAE,Voya Asia Pacific High Dividend Equity Income Fund ING Asia Pacific High Dividend Equity Income Fund Common Shares of Beneficial Interest,8.1001,96381907,United States,2007,Trusts Except Educational Religious and Charitable
IAG,Iamgold Corporation Ordinary Shares,3.11,1483159000,Canada,NA,
IBA,Industrias Bachoco S.A.B. de C.V. Common Stock,40.85,2042500000,Mexico,1997,Meat/Poultry/Fish
IBER,Ibere Pharmaceuticals Class A Ordinary Shares,9.72,167670000,,2021,
IBM,International Business Machines Corporation Common Stock,133.94,97989616915,United States,NA,EDP Services
IBN,ICICI Bank Limited Common Stock,19.66,68247041719,India,NA,Commercial Banks
IBP,Installed Building Products Inc. Common Stock,140.01,4159298772,,2014,Homebuilding
ICD,Independence Contract Drilling Inc. Common Stock,3.0417,29087938,,2014,Oil & Gas Production
ICE,Intercontinental Exchange Inc. Common Stock,136.99,77180759989,United States,2005,Investment Bankers/Brokers/Service
ICL,ICL Group Ltd. Ordinary Shares,9.7,12485366126,Israel,2014,Agricultural Chemicals
ICNC,Iconic Sports Acquisition Corp. Class A Ordinary Shares,9.9,426937500,,2021,
ICR^A,InPoint Commercial Real Estate Income Inc. 6.75% Series A Cumulative Redeemable Preferred Stock,25.04,NA,,NA,
IDA,IDACORP Inc. Common Stock,112.665,5691439107,United States,NA,Electric Utilities: Central
IDE,Voya Infrastructure Industrials and Materials Fund Common Shares of Beneficial Interest,12.0916,199648023,United States,2010,Finance/Investors Services
IDT,IDT Corporation Class B Common Stock,44.989,1159000949,United States,NA,Telecommunications Equipment
IEX,IDEX Corporation Common Stock,236.02,17944953450,United States,1989,Fluid Controls
IFF,International Flavors & Fragrances Inc. Common Stock,148.91,37904592877,United States,NA,Major Chemicals
IFN,India Fund Inc. (The) Common Stock,21.08,567148441,United States,NA,Finance/Investors Services
IFS,Intercorp Financial Services Inc. Common Shares,26.68,3079355735,,2019,Commercial Banks
IGA,Voya Global Advantage and Premium Opportunity Fund Common Shares of Beneficial Interest,10.4127,170553018,United States,2005,Investment Managers
IGD,Voya Global Equity Dividend and Premium Opportunity Fund,6.2324,503143734,United States,2005,Trusts Except Educational Religious and Charitable
IGI,Western Asset Investment Grade Defined Opportunity Trust Inc. Common Stock,21.7,235311241,United States,2009,Investment Managers
IGR,CBRE Global Real Estate Income Fund Common Shares of Beneficial Interest,9.605,1119851695,United States,2004,Finance Companies
IGT,International Game Technology Ordinary Shares,28.82,5913518160,United States,2015,Movies/Entertainment
IH,iHuman Inc. American depositary shares each representing five Class A ordinary shares,2.79,148775288,United States,2020,Other Consumer Services
IHC,Independence Holding Company Common Stock,56.59,830454628,United States,NA,Life Insurance
IHD,Voya Emerging Markets High Income Dividend Equity Fund Common Shares,7.1201,135561642,United States,2011,Investment Managers
IHG,Intercontinental Hotels Group American Depositary Shares (Each representing one Ordinary Share),64.84,11879745670,United Kingdom,NA,Hotels/Resorts
IHIT,Invesco High Income 2023 Target Term Fund Common Shares of Beneficial Interest,9.24,222720175,United States,2016,Investment Managers
IHS,IHS Holding Limited Ordinary Shares,14.02,4599315243,,2021,
IHTA,Invesco High Income 2024 Target Term Fund Common Shares of Beneficial Interest No par value per share,9.7508,85636391,,2017,Finance/Investors Services
IIF,Morgan Stanley India Investment Fund Inc. Common Stock,26.49,296734702,United States,1994,Trusts Except Educational Religious and Charitable
IIIN,Insteel Industries Inc. Common Stock,39.84,773213923,United States,NA,
IIM,Invesco Value Municipal Income Trust Common Stock,16.94,797137415,United States,NA,Investment Managers
IIPR,Innovative Industrial Properties Inc. Common Stock,263.6,6307500934,United States,2016,Real Estate Investment Trusts
IIPR^A,Innovative Industrial Properties Inc. 9.00% Series A Cumulative Redeemable Preferred Stock,33.2,NA,United States,NA,
IMAX,Imax Corporation Common Stock,18.2763,1079800338,Canada,NA,
IMPX,AEA-Bridges Impact Corp. Class A Ordinary Shares,9.98,499000000,,2020,Business Services
INAQ,Insight Acquisition Corp. Class A Common Stock,9.76,292800000,,2021,
INFA,Informatica Inc. Class A Common Stock,37.37,10396327871,,2021,EDP Services
INFO,IHS Markit Ltd. Common Shares,132.83,52978100240,Bermuda,1996,Business Services
INFY,Infosys Limited American Depositary Shares,25.443,106618205837,India,NA,EDP Services
ING,ING Group N.V. Common Stock,13.9,52482770529,Netherlands,1997,Commercial Banks
INGR,Ingredion Incorporated Common Stock,96.97,6451989326,United States,NA,Farming/Seeds/Milling
INN,Summit Hotel Properties Inc. Common Stock,9.89,1052798016,United States,2011,Real Estate Investment Trusts
INN^E,Summit Hotel Properties Inc. 6.250% Series E Cumulative Redeemable Preferred Stock,25,NA,United States,NA,
INN^F,Summit Hotel Properties Inc. 5.875% Series F Cumulative Redeemable Preferred Stock $0.01 par value per share,25.52,NA,United States,NA,
INSI,Insight Select Income Fund,22.31,238940881,United States,NA,Investment Managers
INSP,Inspire Medical Systems Inc. Common Stock,233.74,6394682060,United States,1998,Biotechnology: Electromedical & Electrotherapeutic Apparatus
INST,Instructure Holdings Inc. Common Stock,23.535,3304875357,,2021,Computer Software: Prepackaged Software
INSW,International Seaways Inc. Common Stock,14.76,732273400,,2016,Marine Transportation
INSW^A,International Seaways Inc. 8.50% Senior Notes due June 30 2023,25.94,NA,,NA,
INT,World Fuel Services Corporation Common Stock,26.825,1694525459,United States,NA,Oil Refining/Marketing
INVH,Invitation Homes Inc. Common Stock,45.215,26982895595,United States,2017,Real Estate Investment Trusts
IO,Ion Geophysical Corporation Common Stock,0.9114,26992970,United States,NA,Oilfield Services/Equipment
IONQ,IonQ Inc. Common Stock,17.72,3410871483,United States,2021,Wholesale Distributors
IOT,Samsara Inc. Class A Common Stock,26.91,13464990607,,2021,Retail: Computer Software & Peripheral Equipment
IP,International Paper Company Common Stock,46.765,18110362098,United States,NA,Containers/Packaging
IPG,Interpublic Group of Companies Inc. (The) Common Stock,37.835,14897730262,United States,NA,Advertising
IPI,Intrepid Potash Inc Common Stock,44.28,595259582,United States,2008,Major Chemicals
IPOD,Social Capital Hedosophia Holdings Corp. IV Class A Ordinary Shares,10.2301,588230750,United States,2020,Business Services
IPOF,Social Capital Hedosophia Holdings Corp. VI Class A Ordinary Shares,10.28,1477750000,United States,2020,Business Services
IPVA,InterPrivate II Acquisition Corp. Class A Common Stock,9.6879,315280596,,2021,
IPVF,InterPrivate III Financial Partners Inc. Class A Common Stock,9.92,329703600,,2021,
IQI,Invesco Quality Municipal Income Trust Common Stock,13.6,719219639,United States,NA,Finance Companies
IQV,IQVIA Holdings Inc. Common Stock,284.1,54274322234,United States,2013,Managed Health Care
IR,Ingersoll Rand Inc. Common Stock,61.49,25062378591,United States,2017,Industrial Machinery/Components
IRL,New Ireland Fund Inc (The) Common Stock,10.6301,38692522,United States,1990,Trusts Except Educational Religious and Charitable
IRM,Iron Mountain Incorporated (Delaware)Common Stock REIT,52.38,15166602705,United States,NA,Real Estate Investment Trusts
IRNT,IronNet Inc. Common Stock,4.1695,369912328,United States,2020,EDP Services
IRS,IRSA Inversiones Y Representaciones S.A. Common Stock,4.294,282848872,Argentina,NA,Homebuilding
IRT,Independence Realty Trust Inc. Common Stock,25.055,5535473559,United States,2013,Real Estate Investment Trusts
IS,ironSource Ltd. Class A Ordinary Shares,8.14,8263992664,,2021,
ISD,PGIM High Yield Bond Fund Inc.,16,532107584,United States,2012,Trusts Except Educational Religious and Charitable
IT,Gartner Inc. Common Stock,335.35,27578852004,United States,1993,Diversified Commercial Services
ITCB,Itau CorpBanca American Depositary Shares (each representing 1500 shares of Common Stock no par value),2.9499,1902980699,Chile,NA,Commercial Banks
ITGR,Integer Holdings Corporation Common Stock,85.94,2837641430,United States,NA,Medical/Dental Instruments
ITT,ITT Inc. Common Stock,102.505,8774428000,United States,2011,Fluid Controls
ITUB,Itau Unibanco Banco Holding SA American Depositary Shares (Each repstg 500 Preferred shares),3.745,36625690383,Brazil,NA,Commercial Banks
ITW,Illinois Tool Works Inc. Common Stock,245.4,77026329915,United States,NA,Industrial Machinery/Components
IVAN,Ivanhoe Capital Acquisition Corp. Class A Ordinary Shares,9.945,343102500,,2021,Business Services
IVC,Invacare Corporation Common Stock,2.835,99280798,United States,NA,Industrial Specialties
IVH,Delaware Ivy High Income Opportunities Fund,13.92,230654400,,2013,Investment Managers
IVR,INVESCO MORTGAGE CAPITAL INC Common Stock,2.885,899372093,United States,2009,Real Estate Investment Trusts
IVR^B,Invesco Mortgage Capital Inc. Preferred Series B Cum Fxd to Fltg,24.95,NA,United States,NA,
IVR^C,INVESCO MORTGAGE CAPITAL INC 7.5% Fixed-to-Floating Series C Cumulative Redeemable Preferred Stock Liquation Preference $25.00 per Share,24.81,NA,United States,NA,
IVT,InvenTrust Properties Corp. Common Stock,27.49,1958975968,,2021,Real Estate Investment Trusts
IVZ,Invesco Ltd Common Stock,23.385,10785314400,United States,NA,Investment Managers
IX,Orix Corp Ads Common Stock,102.4769,24538487831,Japan,NA,Diversified Financial Services
J,Jacobs Engineering Group Inc. Common Stock,139.05,18000491655,United States,NA,Oilfield Services/Equipment
JATT,JATT Acquisition Corp Class A Ordinary Shares,9.85,169912500,,2021,
JBGS,JBG SMITH Properties Common Shares,29.16,3782789427,United States,2017,Real Estate Investment Trusts
JBI,Janus International Group Inc. Common Stock,12.7,1861333806,,2021,
JBK,Lehman ABS 3.50 3.50% Adjustable Corp Backed Tr Certs GS Cap I,30.567,0,United States,NA,Trusts Except Educational Religious and Charitable
JBL,Jabil Inc. Common Stock,70.59,10176678575,United States,1993,Electrical Products
JBT,John Bean Technologies Corporation Common Stock,154.125,4896262574,United States,NA,Diversified Manufacture
JCE,Nuveen Core Equity Alpha Fund Nuveen Core Equity Alpha Fund Common Shares of Beneficial Interest,17.95,287725594,United States,2007,Trusts Except Educational Religious and Charitable
JCI,Johnson Controls International plc Ordinary Share,81.27,57241093742,Switzerland,NA,Industrial Machinery/Components
JCO,Nuveen Credit Opportunities 2022 Target Term Fund Common Shares of Beneficial Interest,8.08,224334881,United States,2017,Trusts Except Educational Religious and Charitable
JEF,Jefferies Financial Group Inc. Common Stock,39.31,9653008728,United States,NA,Finance/Investors Services
JELD,JELD-WEN Holding Inc. Common Stock,26.46,2424368870,United States,2017,
JEMD,Nuveen Emerging Markets Debt 2022 Target Term Fund Common Shares of Beneficial Interest $0.01 par value per share,7.5399,107432160,,2017,Investment Managers
JEQ,Aberdeen Japan Equity Fund Inc.  Common Stock,8.1205,108884017,United States,1992,Finance Companies
JFR,Nuveen Floating Rate Income Fund Common Stock,10.099,574819608,United States,2004,Trusts Except Educational Religious and Charitable
JGH,Nuveen Global High Income Fund Common Shares of Beneficial Interest,15.825,366782244,United States,2014,Investment Managers
JHAA,Nuveen Corporate Income 2023 Target Term Fund,9.97,78023306,,2018,Finance/Investors Services
JHG,Janus Henderson Group plc Ordinary Shares,42.585,7241142924,,2017,Investment Managers
JHI,John Hancock Investors Trust Common Stock,19.02,165829275,United States,NA,Trusts Except Educational Religious and Charitable
JHS,John Hancock Income Securities Trust Common Stock,15.29,178076285,United States,NA,Finance Companies
JHX,James Hardie Industries plc American Depositary Shares (Ireland),40.91,18210164389,Ireland,NA,Building Materials
JILL,J. Jill Inc. Common Stock,18.9102,188875664,,2017,Clothing/Shoe/Accessory Stores
JKS,JinkoSolar Holding Company Limited American Depositary Shares (each representing 4 Common Shares),46.59,2221980903,China,2010,Semiconductors
JLL,Jones Lang LaSalle Incorporated Common Stock,274.02,13829353434,United States,NA,Real Estate
JLS,Nuveen Mortgage and Income Fund,20.9332,114869679,United States,2009,Investment Managers
JMIA,Jumia Technologies AG American Depositary Shares each representing two Ordinary Shares,12.2,1202829525,,2019,Catalog/Specialty Distribution
JMM,Nuveen Multi-Market Income Fund (MA),7.365,69690208,United States,NA,Trusts Except Educational Religious and Charitable
JNJ,Johnson & Johnson Common Stock,172.45,453991347304,United States,NA,Biotechnology: Pharmaceutical Preparations
JNPR,Juniper Networks Inc. Common Stock,35.375,11503281872,United States,1999,Computer peripheral equipment
JOBY,Joby Aviation Inc. Common Stock,7.395,4465799044,United States,2020,Aerospace
JOE,St. Joe Company (The) Common Stock,51.63,3040106005,United States,NA,Homebuilding
JOF,Japan Smaller Capitalization Fund Inc Common Stock,7.94,224971110,United States,1990,Trusts Except Educational Religious and Charitable
JP,Jupai Holdings Limited American Depositary Shares each representing six ordinary shares,1.02,33889677,,2015,Other Consumer Services
JPC,Nuveen Preferred & Income Opportunities Fund,9.575,994313558,United States,2003,Investment Managers
JPI,Nuveen Preferred and Income Term Fund Common Shares of Beneficial Interest,25.75,586231272,,2012,Finance Companies
JPM,JP Morgan Chase & Co. Common Stock,158.7422,469125436108,United States,NA,Major Banks
JPM^C,J P Morgan Chase & Co Depositary Shares each representing a 1/400th interest in a share of 6.00% Non-Cumulative  Preferred Stock Series EE,27.3,NA,United States,NA,
JPM^D,J P Morgan Chase & Co Depositary Shares each representing a 1/400th  interest in a share of 5.75% Non-Cumulative  Preferred Stock Series DD,26.78,NA,United States,NA,
JPM^J,J P Morgan Chase & Co Depositary Shares each representing a 1/400th interest in a share of JPMorgan Chase & Co. 4.75% Non-Cumulative Preferred Stock Series GG,26.38,NA,United States,NA,
JPM^K,J P Morgan Chase & Co Depositary Shares each representing a 1/400th interest in a share of 4.55% Non-Cumulative Preferred Stock Series JJ,26.19,NA,United States,NA,
JPM^L,J P Morgan Chase & Co Depositary Shares each representing a 1/400th interest in a share of 4.625% Non-Cumulative Preferred Stock Series LL,26.23,NA,United States,NA,
JPM^M,J P Morgan Chase & Co Depositary Shares each representing a 1/400th interest in a share of 4.20% Non-Cumulative Preferred Stock Series MM,25.5493,NA,United States,NA,
JPS,Nuveen Preferred & Income Securities Fund,9.59,1963653722,United States,2002,Investment Managers
JPT,Nuveen Preferred and Income 2022 Term Fund Common Shares of Beneficial Interest,24.4,167048280,United States,2017,Trusts Except Educational Religious and Charitable
JQC,Nuveen Credit Strategies Income Fund Shares of Beneficial Interest,6.5,881460385,United States,2003,Finance Companies
JRI,Nuveen Real Asset Income and Growth Fund Common Shares of Beneficial Interest,15.77,432944534,United States,2012,Finance Companies
JRO,Nuveen Floating Rate Income Opportuntiy Fund Shares of Beneficial Interest,10.0901,409064944,United States,2004,Investment Managers
JRS,Nuveen Real Estate Income Fund Common Shares of Beneficial Interest,12.66,365778683,United States,2001,Finance/Investors Services
JSD,Nuveen Short Duration Credit Opportunities Fund Common Shares of Beneficial Interest,14.83,149570160,United States,2011,Finance Companies
JT,Jianpu Technology Inc. American depositary shares,0.98,20757747,,2017,EDP Services
JUN,Juniper II Corp. Class A Common Stock,9.83,367396250,,2021,
JW/A,John Wiley & Sons Inc.,57.46,NA,United States,NA,
JW/B,John Wiley & Sons Inc.,55.83,NA,United States,NA,
JWN,Nordstrom Inc. Common Stock,23.1799,3692868866,United States,NA,Clothing/Shoe/Accessory Stores
JWSM,Jaws Mustang Acquisition Corp. Class A Ordinary Shares,9.7491,1261289813,,2021,Business Services
JXN,Jackson Financial Inc. Class A Common Stock,41.79,3947664894,,2021,Finance/Investors Services
K,Kellogg Company Common Stock,63.92,21804569568,United States,NA,Packaged Foods
KAHC,KKR Acquisition Holdings I Corp. Class A Common Stock,9.75,1681875000,,2021,
KAI,Kadant Inc Common Stock,230.1,2670094666,United States,NA,Industrial Machinery/Components
KAMN,Kaman Corporation Common Stock,43.08,1199788038,United States,NA,Military/Government/Technical
KAR,KAR Auction Services Inc Common Stock,15.675,1899095392,United States,2009,
KB,KB Financial Group Inc,46.22,18008898964,South Korea,NA,Commercial Banks
KBH,KB Home Common Stock,45.03,3939117814,United States,1986,
KBR,KBR Inc. Common Stock,47.23,6625675569,United States,2006,Oilfield Services/Equipment
KCGI,Kensington Capital Acquisition Corp. V Class A Ordinary Shares,9.82,338790000,,2021,
KD,Kyndryl Holdings Inc. Common Stock,18.53,4153240840,,2021,EDP Services
KEN,Kenon Holdings Ltd. Ordinary Shares,51.26,2761843537,Singapore,2015,Electric Utilities: Central
KEP,Korea Electric Power Corporation Common Stock,9.16,11760781891,South Korea,1994,Electrical Products
KEX,Kirby Corporation Common Stock,59.1,3552560100,United States,NA,Marine Transportation
KEY,KeyCorp Common Stock,23.305,21698313332,United States,NA,Major Banks
KEY^I,KeyCorp Depositary Shares Each Representing a 1/40th Ownership Interest in a Share of Fixed-to-Floating Rate Perpetual Non-Cumulative Preferred Stock Series E,30.25,NA,United States,NA,
KEY^J,KeyCorp Depositary Shares each representing a 1/40th ownership interest in a share of Fixed Rate Perpetual Non-Cumulative Preferred Stock Series F,26.63,NA,United States,NA,
KEY^K,KeyCorp Depositary Shares each representing a 1/40th ownership interest in a share of Fixed Rate Perpetual Non-Cumulative Preferred Stock Series G,27.07,NA,United States,NA,
KEYS,Keysight Technologies Inc. Common Stock,208.88,38233912805,United States,2014,Industrial Machinery/Components
KF,Korea Fund Inc. (The) New Common Stock,33.96,171190628,United States,NA,Investment Managers
KFS,Kingsway Financial Services Inc. Common Stock (DE),5.45,131391183,Canada,NA,
KFY,Korn Ferry Common Stock,76.82,4180102070,United States,1999,Diversified Commercial Services
KGC,Kinross Gold Corporation Common Stock,5.705,7150647000,Canada,NA,
KIM,Kimco Realty Corporation Common Stock,24.58,15151801666,United States,NA,Real Estate Investment Trusts
KIM^L,Kimco Realty Corporation Class L Depositary Shares each of which represents a one-one thousandth fractional interest in a share of 5.125% Class L Cumulative Redeemable Preferred Stock liquidation preference $25000.00 per share,25.7866,NA,United States,NA,
KIM^M,Kimco Realty Corporation Class M Depositary Shares each of which represents a one-one thousandth fractional interest in a share of 5.25% Class M Cumulative Redeemable Preferred Stock liquidation preference $25000.00 per share,26.0689,NA,United States,NA,
KIND,Nextdoor Holdings Inc. Class A Common Stock,8.45,3235992050,United States,NA,EDP Services
KIO,KKR Income Opportunities Fund Common Shares,16.43,334191375,,2013,Investment Managers
KKR,KKR & Co. Inc. Common Stock,75.385,44100920653,United States,NA,Investment Managers
KKR^C,KKR & Co. Inc. 6.00% Series C Mandatory Convertible Preferred Stock,94.67,NA,United States,NA,
KKRS,KKR Group Finance Co. IX LLC 4.625% Subordinated Notes due 2061,26.01,0,,2021,
KL,Kirkland Lake Gold Ltd. Common Shares,41.11,10840574215,,NA,
KLR,Kaleyra Inc. Common Stock,9.4,391818047,United States,2018,Internet and Information Services
KMB,Kimberly-Clark Corporation Common Stock,141.49,47642048996,United States,NA,Paper
KMF,Kayne Anderson NextGen Energy & Infrastructure Inc.,7.1684,338330287,,2010,Investment Managers
KMI,Kinder Morgan Inc. Common Stock,15.835,35859665202,United States,2011,Natural Gas Distribution
KMPR,Kemper Corporation,58.81,3743441399,United States,NA,Property-Casualty Insurers
KMT,Kennametal Inc. Common Stock,36.25,3032132193,United States,NA,Industrial Machinery/Components
KMX,CarMax Inc,128.64,20823204175,United States,NA,Other Specialty Stores
KN,Knowles Corporation Common Stock,23.38,2159037112,,2014,Consumer Electronics/Appliances
KNOP,KNOT Offshore Partners LP Common Units representing Limited Partner Interests,13.22,443960201,United Kingdom,2013,Marine Transportation
KNX,Knight-Swift Transportation Holdings Inc.,61.4,10189768949,United States,2017,Trucking Freight/Courier Services
KO,Coca-Cola Company (The) Common Stock,58.83,254111492484,United States,NA,Beverages (Production/Distribution)
KODK,Eastman Kodak Company Common New,4.825,379496865,United States,NA,Business Services
KOF,Coca Cola Femsa S.A.B. de C.V.  American Depositary Shares each representing 10 Units (each Unit consists of 3 Series B Shares and 5 Series L Shares),54.6,11470544140,Mexico,1993,Beverages (Production/Distribution)
KOP,Koppers Holdings Inc. Koppers Holdings Inc. Common Stock,31.4582,670258319,United States,2006,Industrial Specialties
KORE,KORE Group Holdings Inc. Common Stock,6.86,493847504,,NA,
KOS,Kosmos Energy Ltd. Common Shares (DE),3.52,1590649498,Bermuda,2011,Oil & Gas Production
KR,Kroger Company (The) Common Stock,45.055,33126939436,United States,NA,Food Chains
KRA,Kraton Corporation Common Stock,46.33,1489423141,United States,2009,Major Chemicals
KRC,Kilroy Realty Corporation Common Stock,67.61,7873974388,United States,1997,Real Estate Investment Trusts
KREF,KKR Real Estate Finance Trust Inc. Common Stock,20.9108,1271865325,United States,2017,Real Estate Investment Trusts
KREF^A,KKR Real Estate Finance Trust Inc. 6.50% Series A Cumulative Redeemable Preferred Stock,25.65,NA,United States,NA,
KRG,Kite Realty Group Trust Common Stock,21.87,4789795305,United States,2004,Real Estate Investment Trusts
KRO,Kronos Worldwide Inc Common Stock,14.96,1728626758,United States,NA,Major Chemicals
